{"apiVersion":"bugate.io/v2","delivery_criteria":["business_understanding","test_design","implementation","execution","report","knowledge"],"goal":"Verify bounded integers","id":"neutral-profile","kind":"Profile","requirements":["R1"],"resource_boundaries":{"destructive":false,"network":false,"notes":"Generated local fixture"},"risks":["K1"],"sources":[{"description":"Generated requirement contract","digest":"sha256:273d8bb934d83d46c6f2df4233f6dda130de7e522bffa88764f451397154b68e","id":"SRC1","path":"requirements.md"}],"unknowns":[],"version":"1"}
